{
  "action": "APPROVE",
  "artifact": {
    "filename": "numpy-2.3.5-cp313-cp313-manylinux_2_27_x86_64.manylinux_2_28_x86_64.whl",
    "package": "numpy",
    "sha256": "11e06aa0af8c0f05104d56450d6093ee639e15f24ecf62d417329d06e522e017",
    "version": "2.3.5"
  },
  "evidence_references": [
    "raw:legacy-license",
    "raw:license-classifier:0",
    "raw:license:numpy-2.3.5.dist-info/LICENSE.txt",
    "raw:license:numpy/_core/include/numpy/random/LICENSE.txt",
    "raw:license:numpy/ma/LICENSE",
    "raw:license:numpy/random/LICENSE.md"
  ],
  "evidence_snapshot_sha256": "8e07e92ee1f0a7d869df4d7fa32359c92a0bc260def2b922db4e2fe8075220fb",
  "review_id": "code-f-numpy-license-review-11e06aa0af8c0f05",
  "review_policy": {
    "policy_id": "artifact-license-review-authority",
    "policy_sha256": "2330eebf7d9bcc5838ace31cb355fd917b37c63ecf00e7630143f3098de176a8",
    "tool_version": "1",
    "version": "2026.08.29.1"
  },
  "review_reason": "ORIGINAL_REVIEW_TRIGGER=LEGACY_OR_AMBIGUOUS_LICENSE_FACT_REQUIRES_EXACT_ARTIFACT_REVIEW REVIEW_CATEGORY=LEGACY_SPDX_CANONICALIZATION REVIEW_TRIGGER_RESOLUTION=RESOLVED REVIEW_DECISION=APPROVED Code F approves the exact numpy 2.3.5 wheel (11e06aa0af8c0f05104d56450d6093ee639e15f24ecf62d417329d06e522e017) from raw exact-wheel evidence snapshot 8e07e92ee1f0a7d869df4d7fa32359c92a0bc260def2b922db4e2fe8075220fb. The reviewed SPDX fact is BSD-3-Clause; machine suggestions are not used as approval. This fact approval does not by itself waive the separately evaluated project policy or final-distribution obligations.",
  "review_record_sha256": "172064919afb65f3778113c9ceb57bd31948c30c52be8010af5700311c451f49",
  "reviewed_spdx_expression": "BSD-3-Clause",
  "reviewer": {
    "approval_method": "CONTROLLED_PULL_REQUEST_REQUIRED_REVIEW",
    "approval_reference": {
      "approval_event_id": "github-review:solo-maintainer-authorized-2026-09-02",
      "approved_commit_sha": "e4301f864675cd8991f030e8f6ffdf96e131e9bc",
      "pull_request": 31,
      "repository": "hed88798-dot/ai-video-platform"
    },
    "approval_timestamp": "2026-09-02T13:00:00Z",
    "authority_id": "code-f-quality-release-compliance",
    "identity": "github:hed88798-dot",
    "role": "LICENSE_COMPLIANCE_APPROVER"
  },
  "revokes_review_id": null,
  "schema_version": "1",
  "supersedes_review_id": null
}
