{
  "action": "APPROVE",
  "artifact": {
    "filename": "pyinstaller-6.22.2-py3-none-manylinux2014_x86_64.whl",
    "package": "pyinstaller",
    "sha256": "9622686ecc5d5fa492fe6cde29d47df9dd41138cff8177be9f901ca3260f2096",
    "version": "6.22.2"
  },
  "evidence_references": [
    "raw:legacy-license",
    "raw:license-classifier:0",
    "raw:copying:pyinstaller-6.22.2.dist-info/licenses/COPYING.txt"
  ],
  "evidence_snapshot_sha256": "eee59425636dffc8a7304242601d99f2041ab812b7e2878c1e670e1f108329a3",
  "review_id": "code-f-pyinstaller-license-review-9622686ecc5d5fa4",
  "review_policy": {
    "policy_id": "artifact-license-review-authority",
    "policy_sha256": "2330eebf7d9bcc5838ace31cb355fd917b37c63ecf00e7630143f3098de176a8",
    "tool_version": "1",
    "version": "2026.08.29.1"
  },
  "review_reason": "ORIGINAL_REVIEW_TRIGGER=LEGACY_LICENSE_TEXT_WITH_BOOTLOADER_EXCEPTION REVIEW_CATEGORY=AMBIGUOUS_LICENSE_EVIDENCE REVIEW_TRIGGER_RESOLUTION=RESOLVED REVIEW_DECISION=APPROVED Code F approves the exact pyinstaller 6.22.2 wheel (9622686ecc5d5fa492fe6cde29d47df9dd41138cff8177be9f901ca3260f2096) from raw exact-wheel evidence snapshot eee59425636dffc8a7304242601d99f2041ab812b7e2878c1e670e1f108329a3. The reviewed SPDX fact is GPL-2.0-or-later WITH Bootloader-exception; machine suggestions are not used as approval. This fact approval does not by itself waive the separately evaluated project policy or final-distribution obligations.",
  "review_record_sha256": "0086c43ee74bb6c730bcf23c3855c051222187399acb55ec4b06b4b6869a5cf6",
  "reviewed_spdx_expression": "GPL-2.0-or-later WITH Bootloader-exception",
  "reviewer": {
    "approval_method": "CONTROLLED_PULL_REQUEST_REQUIRED_REVIEW",
    "approval_reference": {
      "approval_event_id": "github-review:solo-maintainer-authorized-2026-09-02",
      "approved_commit_sha": "e4301f864675cd8991f030e8f6ffdf96e131e9bc",
      "pull_request": 31,
      "repository": "hed88798-dot/ai-video-platform"
    },
    "approval_timestamp": "2026-09-02T13:00:00Z",
    "authority_id": "code-f-quality-release-compliance",
    "identity": "github:hed88798-dot",
    "role": "LICENSE_COMPLIANCE_APPROVER"
  },
  "revokes_review_id": null,
  "schema_version": "1",
  "supersedes_review_id": null
}
