{
  "action": "APPROVE",
  "artifact": {
    "filename": "altgraph-0.17.5-py2.py3-none-any.whl",
    "package": "altgraph",
    "sha256": "f3a22400bce1b0c701683820ac4f3b159cd301acab067c51c653e06961600597",
    "version": "0.17.5"
  },
  "evidence_references": [
    "raw:legacy-license",
    "raw:license-classifier:0",
    "raw:license:altgraph-0.17.5.dist-info/LICENSE"
  ],
  "evidence_snapshot_sha256": "e71c5703ff67064d4a6180d31966d146dd11be94788097bacc1334956d2a71c6",
  "review_id": "code-f-altgraph-license-review-f3a22400bce1b0c7",
  "review_policy": {
    "policy_id": "artifact-license-review-authority",
    "policy_sha256": "2330eebf7d9bcc5838ace31cb355fd917b37c63ecf00e7630143f3098de176a8",
    "tool_version": "1",
    "version": "2026.08.29.1"
  },
  "review_reason": "ORIGINAL_REVIEW_TRIGGER=LEGACY_OR_AMBIGUOUS_LICENSE_FACT_REQUIRES_EXACT_ARTIFACT_REVIEW REVIEW_CATEGORY=LEGACY_SPDX_CANONICALIZATION REVIEW_TRIGGER_RESOLUTION=RESOLVED REVIEW_DECISION=APPROVED Code F approves the exact altgraph 0.17.5 wheel (f3a22400bce1b0c701683820ac4f3b159cd301acab067c51c653e06961600597) from raw exact-wheel evidence snapshot e71c5703ff67064d4a6180d31966d146dd11be94788097bacc1334956d2a71c6. The reviewed SPDX fact is MIT; machine suggestions are not used as approval. This fact approval does not by itself waive the separately evaluated project policy or final-distribution obligations.",
  "review_record_sha256": "51ca4dcf3b203c73e378ce5cc0d7a7960653d037d826e880637ae69d26e85175",
  "reviewed_spdx_expression": "MIT",
  "reviewer": {
    "approval_method": "CONTROLLED_PULL_REQUEST_REQUIRED_REVIEW",
    "approval_reference": {
      "approval_event_id": "github-review:solo-maintainer-authorized-2026-09-02",
      "approved_commit_sha": "e4301f864675cd8991f030e8f6ffdf96e131e9bc",
      "pull_request": 31,
      "repository": "hed88798-dot/ai-video-platform"
    },
    "approval_timestamp": "2026-09-02T13:00:00Z",
    "authority_id": "code-f-quality-release-compliance",
    "identity": "github:hed88798-dot",
    "role": "LICENSE_COMPLIANCE_APPROVER"
  },
  "revokes_review_id": null,
  "schema_version": "1",
  "supersedes_review_id": null
}
