{
  "action": "APPROVE",
  "artifact": {
    "filename": "colorama-0.4.6-py2.py3-none-any.whl",
    "package": "colorama",
    "sha256": "4f1d9991f5acc0ca119f9d443620b77f9d6b33703e51011c16baf57afb285fc6",
    "version": "0.4.6"
  },
  "evidence_references": [
    "raw:license-classifier:0",
    "raw:license:colorama-0.4.6.dist-info/licenses/LICENSE.txt"
  ],
  "evidence_snapshot_sha256": "f906f1434a1fa43196295f43df30ff0d461a3c924e6323741d1317e3deb06050",
  "review_id": "code-f-colorama-license-review-4f1d9991f5acc0ca",
  "review_policy": {
    "policy_id": "artifact-license-review-authority",
    "policy_sha256": "2330eebf7d9bcc5838ace31cb355fd917b37c63ecf00e7630143f3098de176a8",
    "tool_version": "1",
    "version": "2026.08.29.1"
  },
  "review_reason": "ORIGINAL_REVIEW_TRIGGER=LICENSE_ASSERTION_REQUIRES_EXACT_ARTIFACT_COMPANION_REVIEW REVIEW_CATEGORY=AMBIGUOUS_LICENSE_EVIDENCE REVIEW_TRIGGER_RESOLUTION=RESOLVED REVIEW_DECISION=APPROVED Code F approves the exact colorama 0.4.6 wheel (4f1d9991f5acc0ca119f9d443620b77f9d6b33703e51011c16baf57afb285fc6) from raw exact-wheel evidence snapshot f906f1434a1fa43196295f43df30ff0d461a3c924e6323741d1317e3deb06050. The reviewed SPDX fact is BSD-3-Clause; machine suggestions are not used as approval. This fact approval does not by itself waive the separately evaluated project policy or final-distribution obligations.",
  "review_record_sha256": "ea30c6cfa5a17f22ea2906245f957532cbd8848337dd5b5f66ed376db592c140",
  "reviewed_spdx_expression": "BSD-3-Clause",
  "reviewer": {
    "approval_method": "CONTROLLED_PULL_REQUEST_REQUIRED_REVIEW",
    "approval_reference": {
      "approval_event_id": "github-review:solo-maintainer-authorized-2026-09-02",
      "approved_commit_sha": "e4301f864675cd8991f030e8f6ffdf96e131e9bc",
      "pull_request": 31,
      "repository": "hed88798-dot/ai-video-platform"
    },
    "approval_timestamp": "2026-09-02T13:00:00Z",
    "authority_id": "code-f-quality-release-compliance",
    "identity": "github:hed88798-dot",
    "role": "LICENSE_COMPLIANCE_APPROVER"
  },
  "revokes_review_id": null,
  "schema_version": "1",
  "supersedes_review_id": null
}
