{
  "action": "APPROVE",
  "artifact": {
    "filename": "flatbuffers-25.12.19-py2.py3-none-any.whl",
    "package": "flatbuffers",
    "sha256": "7634f50c427838bb021c2d66a3d1168e9d199b0607e6329399f04846d42e20b4",
    "version": "25.12.19"
  },
  "evidence_references": ["raw:legacy-license", "raw:license-classifier:0"],
  "evidence_snapshot_sha256": "514cbe997880e3c5a5105d4882738062b14d5393df9f3e533c1ec48f35fe9926",
  "review_id": "code-f-flatbuffers-license-review-7634f50c427838bb",
  "review_policy": {
    "policy_id": "artifact-license-review-authority",
    "policy_sha256": "2330eebf7d9bcc5838ace31cb355fd917b37c63ecf00e7630143f3098de176a8",
    "tool_version": "1",
    "version": "2026.08.29.1"
  },
  "review_reason": "ORIGINAL_REVIEW_TRIGGER=LEGACY_OR_AMBIGUOUS_LICENSE_FACT_REQUIRES_EXACT_ARTIFACT_REVIEW REVIEW_CATEGORY=LEGACY_SPDX_CANONICALIZATION REVIEW_TRIGGER_RESOLUTION=RESOLVED REVIEW_DECISION=APPROVED Code F approves the exact flatbuffers 25.12.19 wheel (7634f50c427838bb021c2d66a3d1168e9d199b0607e6329399f04846d42e20b4) from raw exact-wheel evidence snapshot 514cbe997880e3c5a5105d4882738062b14d5393df9f3e533c1ec48f35fe9926. The reviewed SPDX fact is Apache-2.0; machine suggestions are not used as approval. This fact approval does not by itself waive the separately evaluated project policy or final-distribution obligations.",
  "review_record_sha256": "23159715dcef16a5d9b730805f5ebefa6e42746b2c04a550d709d87dcb4bac07",
  "reviewed_spdx_expression": "Apache-2.0",
  "reviewer": {
    "approval_method": "CONTROLLED_PULL_REQUEST_REQUIRED_REVIEW",
    "approval_reference": {
      "approval_event_id": "github-review:solo-maintainer-authorized-2026-09-02",
      "approved_commit_sha": "e4301f864675cd8991f030e8f6ffdf96e131e9bc",
      "pull_request": 31,
      "repository": "hed88798-dot/ai-video-platform"
    },
    "approval_timestamp": "2026-09-02T13:00:00Z",
    "authority_id": "code-f-quality-release-compliance",
    "identity": "github:hed88798-dot",
    "role": "LICENSE_COMPLIANCE_APPROVER"
  },
  "revokes_review_id": null,
  "schema_version": "1",
  "supersedes_review_id": null
}
