{
  "action": "APPROVE",
  "artifact": {
    "filename": "onnxruntime-1.29.0-cp313-cp313-win_amd64.whl",
    "package": "onnxruntime",
    "sha256": "2945e1f82f81f27e88decea88c7861f45baea23818950d467bf3909aa303119e",
    "version": "1.29.0"
  },
  "evidence_references": [
    "raw:legacy-license",
    "raw:license-classifier:0",
    "raw:license:onnxruntime/LICENSE"
  ],
  "evidence_snapshot_sha256": "58e9df61d3cdb4a6fd9c0df5d3c507c14ac6b289f82b953d2dc160d704a50721",
  "review_id": "code-f-onnxruntime-license-review-2945e1f82f81f27e",
  "review_policy": {
    "policy_id": "artifact-license-review-authority",
    "policy_sha256": "2330eebf7d9bcc5838ace31cb355fd917b37c63ecf00e7630143f3098de176a8",
    "tool_version": "1",
    "version": "2026.08.29.1"
  },
  "review_reason": "ORIGINAL_REVIEW_TRIGGER=LEGACY_OR_AMBIGUOUS_LICENSE_FACT_REQUIRES_EXACT_ARTIFACT_REVIEW REVIEW_CATEGORY=LEGACY_SPDX_CANONICALIZATION REVIEW_TRIGGER_RESOLUTION=RESOLVED REVIEW_DECISION=APPROVED Code F approves the exact onnxruntime 1.29.0 wheel (2945e1f82f81f27e88decea88c7861f45baea23818950d467bf3909aa303119e) from raw exact-wheel evidence snapshot 58e9df61d3cdb4a6fd9c0df5d3c507c14ac6b289f82b953d2dc160d704a50721. The reviewed SPDX fact is MIT; machine suggestions are not used as approval. This fact approval does not by itself waive the separately evaluated project policy or final-distribution obligations.",
  "review_record_sha256": "b47e0e53bc0235a2348f944312d2c28f353dc3f1e1e579bfa022182d713022ce",
  "reviewed_spdx_expression": "MIT",
  "reviewer": {
    "approval_method": "CONTROLLED_PULL_REQUEST_REQUIRED_REVIEW",
    "approval_reference": {
      "approval_event_id": "github-review:solo-maintainer-authorized-2026-09-02",
      "approved_commit_sha": "e4301f864675cd8991f030e8f6ffdf96e131e9bc",
      "pull_request": 31,
      "repository": "hed88798-dot/ai-video-platform"
    },
    "approval_timestamp": "2026-09-02T13:00:00Z",
    "authority_id": "code-f-quality-release-compliance",
    "identity": "github:hed88798-dot",
    "role": "LICENSE_COMPLIANCE_APPROVER"
  },
  "revokes_review_id": null,
  "schema_version": "1",
  "supersedes_review_id": null
}
