{
  "action": "APPROVE",
  "artifact": {
    "filename": "pefile-2024.8.26-py3-none-any.whl",
    "package": "pefile",
    "sha256": "76f8b485dcd3b1bb8166f1128d395fa3d87af26360c2358fb75b80019b957c6f",
    "version": "2024.8.26"
  },
  "evidence_references": ["raw:legacy-license", "raw:license:pefile-2024.8.26.dist-info/LICENSE"],
  "evidence_snapshot_sha256": "7ad13b94bc781e1e41445c46245176f56be56b75ae7711689a1085f8f1b96319",
  "review_id": "code-f-pefile-license-review-76f8b485dcd3b1bb",
  "review_policy": {
    "policy_id": "artifact-license-review-authority",
    "policy_sha256": "2330eebf7d9bcc5838ace31cb355fd917b37c63ecf00e7630143f3098de176a8",
    "tool_version": "1",
    "version": "2026.08.29.1"
  },
  "review_reason": "ORIGINAL_REVIEW_TRIGGER=LEGACY_OR_AMBIGUOUS_LICENSE_FACT_REQUIRES_EXACT_ARTIFACT_REVIEW REVIEW_CATEGORY=LEGACY_SPDX_CANONICALIZATION REVIEW_TRIGGER_RESOLUTION=RESOLVED REVIEW_DECISION=APPROVED Code F approves the exact pefile 2024.8.26 wheel (76f8b485dcd3b1bb8166f1128d395fa3d87af26360c2358fb75b80019b957c6f) from raw exact-wheel evidence snapshot 7ad13b94bc781e1e41445c46245176f56be56b75ae7711689a1085f8f1b96319. The reviewed SPDX fact is MIT; machine suggestions are not used as approval. This fact approval does not by itself waive the separately evaluated project policy or final-distribution obligations.",
  "review_record_sha256": "61ed21d1f03d51761574e808f75a9ccd2d8031a7b032b73416f07ccd2c8035a3",
  "reviewed_spdx_expression": "MIT",
  "reviewer": {
    "approval_method": "CONTROLLED_PULL_REQUEST_REQUIRED_REVIEW",
    "approval_reference": {
      "approval_event_id": "github-review:solo-maintainer-authorized-2026-09-02",
      "approved_commit_sha": "e4301f864675cd8991f030e8f6ffdf96e131e9bc",
      "pull_request": 31,
      "repository": "hed88798-dot/ai-video-platform"
    },
    "approval_timestamp": "2026-09-02T13:00:00Z",
    "authority_id": "code-f-quality-release-compliance",
    "identity": "github:hed88798-dot",
    "role": "LICENSE_COMPLIANCE_APPROVER"
  },
  "revokes_review_id": null,
  "schema_version": "1",
  "supersedes_review_id": null
}
