{
  "action": "APPROVE",
  "artifact": {
    "filename": "protobuf-7.36.0-cp310-abi3-manylinux2014_x86_64.whl",
    "package": "protobuf",
    "sha256": "70f5ec8eb0da81a44360c0dc0beac99a0d78071d21956a7076bae8bd2051841b",
    "version": "7.36.0"
  },
  "evidence_references": ["raw:legacy-license", "raw:license:protobuf-7.36.0.dist-info/LICENSE"],
  "evidence_snapshot_sha256": "d871d17589f75bc9ffc320821a6b58e3f2a0647d278d9c5517d978927a7c03a8",
  "review_id": "code-f-protobuf-license-review-70f5ec8eb0da81a4",
  "review_policy": {
    "policy_id": "artifact-license-review-authority",
    "policy_sha256": "2330eebf7d9bcc5838ace31cb355fd917b37c63ecf00e7630143f3098de176a8",
    "tool_version": "1",
    "version": "2026.08.29.1"
  },
  "review_reason": "ORIGINAL_REVIEW_TRIGGER=LEGACY_OR_AMBIGUOUS_LICENSE_FACT_REQUIRES_EXACT_ARTIFACT_REVIEW REVIEW_CATEGORY=LEGACY_SPDX_CANONICALIZATION REVIEW_TRIGGER_RESOLUTION=RESOLVED REVIEW_DECISION=APPROVED Code F approves the exact protobuf 7.36.0 wheel (70f5ec8eb0da81a44360c0dc0beac99a0d78071d21956a7076bae8bd2051841b) from raw exact-wheel evidence snapshot d871d17589f75bc9ffc320821a6b58e3f2a0647d278d9c5517d978927a7c03a8. The reviewed SPDX fact is BSD-3-Clause; machine suggestions are not used as approval. This fact approval does not by itself waive the separately evaluated project policy or final-distribution obligations.",
  "review_record_sha256": "fd79bc96695d5063789bff61be328e93e85d1644882538c39f350a181e75294b",
  "reviewed_spdx_expression": "BSD-3-Clause",
  "reviewer": {
    "approval_method": "CONTROLLED_PULL_REQUEST_REQUIRED_REVIEW",
    "approval_reference": {
      "approval_event_id": "github-review:solo-maintainer-authorized-2026-09-02",
      "approved_commit_sha": "e4301f864675cd8991f030e8f6ffdf96e131e9bc",
      "pull_request": 31,
      "repository": "hed88798-dot/ai-video-platform"
    },
    "approval_timestamp": "2026-09-02T13:00:00Z",
    "authority_id": "code-f-quality-release-compliance",
    "identity": "github:hed88798-dot",
    "role": "LICENSE_COMPLIANCE_APPROVER"
  },
  "revokes_review_id": null,
  "schema_version": "1",
  "supersedes_review_id": null
}
